"69751","https://www.paris.fr/evenements/ou-tu-vas-cie-correspondances-69751","Où tu vas - Cie Correspondances","Un spectacle entre théâtre et danse, ou l'histoire d'une rencontre entre deux petites filles (celle qui a fui son pays, celle qui la voit arriver chez elle), d'un espace refusé, de la manière dont on peut dépasser nos peurs et préjugés face à l'autre.","Théâtre Dunois","7 Rue Louise Weiss","75013","Paris","48.8331800041875, 2.37054202816009","payant","conseillée","Public enfants, jeunes et adultes. A partir de 8 ans.","fr","April","2025","April","2025","Event","Ev-75013","kfevkg75","kfevkg75_1868"
"69752","https://www.paris.fr/evenements/les-animations-de-novembre-a-l-heure-joyeuse-69752","Les animations de novembre à L'Heure Joyeuse","Tous les mois, découvrez le programme des animations proposées à la bibliothèque L'Heure Joyeuse.","Bibliothèque L'Heure joyeuse","6-12 rue des Prêtres Saint-Séverin","75005","Paris","48.851833, 2.34494","gratuit","non","Tout public.","fr","October","2024","November","2024","Event","Ev-75005","kfevkg75","kfevkg75_1608"
"69754","https://www.paris.fr/evenements/copie-de-paris-sport-proximite-multisports-au-gymnase-les-orteaux-69754","Copie de Paris sport proximité : multisports au gymnase les Orteaux","Participez à un large choix de disciplines proche de chez vous encadrées par éducateur.rice.s sporti.f.ve.s de la Ville de Paris.","Gymnase les Orteaux","89 rue des Orteaux","75020","Paris","48.8560340175666, 2.40728200525385","gratuit","non","Tout public.","fr","September","2024","August","2025","Event","Ev-75020","kfevkg75","kfevkg75_2290"
"69761","https://www.paris.fr/evenements/festival-de-street-photography-6e-edition-69761","6e Festival de Street Photography - Parcours17","Rendez-vous incontournable des amateurs de street photography, la 6e édition du Festival de Street Photography, organisé par le collectif Regards Croisés, ouvrira ses portes le 12 octobre prochain dans le 17e arrondissement.","Centre Paris Anim' La Jonquière","88, rue de La Jonquière","75017","Paris","48.8947480166772, 2.31907999250996","gratuit","non","Tout public.","fr","October","2024","November","2024","Event","Ev-75017","kfevkg75","kfevkg75_477"
"69764","https://www.paris.fr/evenements/s-perche-cie-l-yeuse-69764","S. Perché - Cie L'Yeuse","Un spectacle de danse dans lequel le danseur, seul en scène, fait corps avec une structure en bois, sculpture en mouvement !","Théâtre Dunois","7 Rue Louise Weiss","75013","Paris","48.8331800041875, 2.37054202816009","payant","conseillée","Public enfants, jeunes et adultes. A partir de 6 ans.","fr","May","2025","May","2025","Event","Ev-75013","kfevkg75","kfevkg75_1220"
"69766","https://www.paris.fr/evenements/poussiere-cie-infra-69766","Poussière - Cie INFRA","Un spectacle de marionnette et théâtre de matière, qui reproduit une éruption volcanique pour raconter en musique le passage de la destruction de l'environnement à sa lente reconstruction.","Théâtre Dunois","7 Rue Louise Weiss","75013","Paris","48.8331800041875, 2.37054202816009","payant","conseillée","Public enfants, jeunes et adultes. A partir de 9 ans.","fr","May","2025","May","2025","Event","Ev-75013","kfevkg75","kfevkg75_2293"
"69792","https://www.paris.fr/evenements/nacken-spat-sonore-sota-salta-69792","Näcken - Spat'Sonore & Söta Sälta","Un concert immersif à cinq instruments qui mélange les paysages sonores fantastiques, \"musique des bruits\" et chansons !","Théâtre Dunois","7 Rue Louise Weiss","75013","Paris","48.8331800041875, 2.37054202816009","payant","conseillée","Public enfants, jeunes et adultes. A partir de 8 ans.","fr","June","2025","June","2025","Event","Ev-75013","kfevkg75","kfevkg75_1712"
"69800","https://www.paris.fr/evenements/atelier-concert-accordeon-sonic-meditations-de-vincent-lhermet-69800","Atelier-concert : ACCORDÉON - \"Sonic Meditations\" de Vincent Lhermet","Assistons au concert \"Sonic Meditations\" de Vincent Lhermet (L'Itinéraire), accompagné d'un atelier autour de l'accordéon et d'un goûter après le spectacle !","Théâtre Dunois","7 Rue Louise Weiss","75013","Paris","48.8331800041875, 2.37054202816009","payant","conseillée","Public enfants, jeunes et adultes. A partir de 6 ans.","fr","January","2025","January","2025","Event","Ev-75013","kfevkg75","kfevkg75_881"
"69802","https://www.paris.fr/evenements/rencontre-en-quete-retracer-son-passe-familial-69802","Rencontre : (En)quête : retracer son passé familial","Les Rendez-Vous de Drancy - (En)quête : retracer son passé familial.","Mémorial de la Shoah de Drancy","110-112 Av. Jean Jaurès","93700","Drancy","48.918814011346, 2.45338498728972","gratuit","obligatoire","Tout public.","fr","December","2024","December","2024","Event","Ev-93700","kfevkg75","kfevkg75_1713"
"69811","https://www.paris.fr/evenements/mario-canonge-annick-tangorra-duo-jazz-69811","MARIO CANONGE & ANNICK TANGORRA Duo Jazz","Le pianiste martiniquais Mario Canonge et la chanteuse Annick Tangorra forment un duo exceptionnel, jonglant avec les nuances du jazz avec une aisance hors du commun.","Le Baiser Salé","58 Rue des Lombards","75001","Paris","48.8598354, 2.3478728","payant","conseillée","Tout public.","fr","October","2024","October","2024","Event","Ev-75001","kfevkg75","kfevkg75_1441"
"69812","https://www.paris.fr/evenements/plein-feu-le-cabaret-extraordinaire-69812","Plein feu - Le cabaret extraordinaire","Avec sa folie, sa bonne humeur et son florilège d’artistes interlopes chanteurs acrobates et musiciens, ce nouvel opus promet surprises et émerveillements…","LE BAL BLOMET","33 Rue Blomet","75015","Paris","48.8427399838542, 2.30613598707419","payant","obligatoire","Tout public.","fr","November","2024","November","2024","Event","Ev-75015","kfevkg75","kfevkg75_193"
"69814","https://www.paris.fr/evenements/olivier-hutman-lamine-cissokho-69814","Olivier Hutman & Lamine Cissokho","OLIVIER HUTMAN piano et LAMINE CISSOKHO kora.","Le Baiser Salé","58 Rue des Lombards","75001","Paris","48.8598354, 2.3478728","payant","obligatoire","Tout public.","fr","April","2025","April","2025","Event","Ev-75001","kfevkg75","kfevkg75_1283"
"69815","https://www.paris.fr/evenements/viviane-ginape-invite-mario-canonge-residence-69815","VIVIANE GINAPÉ invite MARIO CANONGE #Residence","Avec Mario Canonge, le DUO s’engage pour une année de plus en résidence autour de standards de jazz moderne, du blues sans oublier les musiques chaleureuses du Brésil !","Le Baiser Salé","58 Rue des Lombards","75001","Paris","48.8598354, 2.3478728","payant","obligatoire","Tout public.","fr","April","2025","April","2025","Event","Ev-75001","kfevkg75","kfevkg75_1009"
"69816","https://www.paris.fr/evenements/ella-frank-isabelle-georges-frederik-steenbrink-big-band-69816","ELLA & FRANK – ISABELLE GEORGES, FREDERIK STEENBRINK & BIG BAND","Isabelle Georges et Frederik Steenbrink reprennent, le temps d’une soirée, les grands standards de deux monstres sacrés du Jazz Vocal, Ella Fitzgerald et Frank Sinatra…","LE BAL BLOMET","33 Rue Blomet","75015","Paris","48.8427399838542, 2.30613598707419","payant","obligatoire","Tout public.","fr","December","2024","December","2024","Event","Ev-75015","kfevkg75","kfevkg75_1442"
"69819","https://www.paris.fr/evenements/atelier-de-danse-metissee-69819","Atelier de danse métissée","Deux ateliers de danse métissée autour de la gestuelle de Josette Baïz où la créativité, la danse et le mouvement seront mis à l'honneur !","Le Carreau du Temple","2 rue Perrée","75003","Paris","48.864697, 2.361483","payant","obligatoire","Public enfants, jeunes et adultes. A partir de 8 ans.","fr","January","2025","January","2025","Event","Ev-75003","kfevkg75","kfevkg75_2069"
"69833","https://www.paris.fr/evenements/stage-creation-de-jeux-video-69833","Stage Création de jeux vidéo","Ce stage créatif vous permet d’acquérir les connaissances et les bases du logiciel Scratch.","Centre Paris Anim' Baudricourt","6 rue Simone Weil","75013","Paris","48.8236639876029, 2.3641079954636","payant","obligatoire","Public enfants et jeunes. A partir de 8 ans. Jusqu'à 12 ans.","fr","October","2024","October","2024","Event","Ev-75013","kfevkg75","kfevkg75_2714"
"69837","https://www.paris.fr/evenements/road-movie-en-aquarelles-a-travers-17-pays-d-europe-69837","Road movie en aquarelles à travers 17 pays d’Europe","Une exposition de Bruno FortuneR, aquarelliste et auteur de carnets de voyages","Bibliothèque Italie","211 Boulevard Vincent Auriol","75013","Paris","48.8308679819251, 2.35698999946797","gratuit","non","Tout public.","fr","December","2024","March","2025","Event","Ev-75013","kfevkg75","kfevkg75_1161"
"69838","https://www.paris.fr/evenements/les-vacances-a-la-bibliotheque-c-est-magique-69838","Les vacances à la bibliothèque, c'est magique !","Nous vous proposons un programme d'activités sous le signe de la sorcellerie","Bibliothèque Colette Vivier","6 rue Fourneyron","75017","Paris","48.8897829963312, 2.31964300494624","gratuit","non","Tout public. A partir de 3 ans.","fr","October","2024","November","2024","Event","Ev-75017","kfevkg75","kfevkg75_2481"
"69846","https://www.paris.fr/evenements/16h04-special-halloween-69846","16h04 : spécial Halloween !","C'est la tradition djebarienne : tous les ans en octobre, on prépare la Fête d'Halloween ! Ce sont les ados qui l'organisent, et les enfants y ont un rôle crucial : la fabrication de la déco horrifique ! Cette année, on va se perdre dans la forêt sombre et mystérieuse …_x000D_\
Tous les mercredis d'octobre à 16h04, inscription sur place à partir de 15h","Bibliothèque Assia Djebar","1 rue Reynaldo Hahn","75020","Paris","48.8492559915638, 2.41215901561648","gratuit","conseillée","Public enfants et jeunes. A partir de 6 ans. Jusqu'à 12 ans.","fr","October","2024","October","2024","Event","Ev-75020","kfevkg75","kfevkg75_900"
"69849","https://www.paris.fr/evenements/initiation-au-jeu-de-role-special-halloween-69849","Initiation au jeu de rôle : Spécial Halloween","Poltergeist ? Gul ? Oni ? Boogey ? Quelle créature hante notre bibliothèque ?","Médiathèque Hélène Berr","70 rue de Picpus","75012","Paris","48.8425409974728, 2.39747702255727","gratuit","obligatoire","Public jeunes. A partir de 10 ans.","fr","October","2024","October","2024","Event","Ev-75012","kfevkg75","kfevkg75_1090"
"69850","https://www.paris.fr/evenements/16h04-la-fabrique-du-poeme-69850","16h04 : la Fabrique du poème","Manier la langue et apprendre à rimer, quelle chouette activité ! Et ensuite, décorer son poème aux couleurs que l'on aime …_x000D_\
Les mercredis à 16h04, inscriptions sur place à partir de 15h","Bibliothèque Assia Djebar","1 rue Reynaldo Hahn","75020","Paris","48.8492559915638, 2.41215901561648","gratuit","conseillée","Public enfants et jeunes. A partir de 6 ans. Jusqu'à 12 ans.","fr","December","2024","June","2025","Event","Ev-75020","kfevkg75","kfevkg75_258"
"69853","https://www.paris.fr/evenements/portes-ouvertes-a-l-ivt-avec-les-bibliotheques-poles-sourds-69853","WEEK-END CONTES à l'IVT avec les bibliothèques Pôles Sourds","Les bibliothécaires des Pôles Sourds de la ville de Paris, en partenariat avec l’IVT, fêtent les contes à travers des lectures en LSF, des jeux et des ateliers créatifs.","International Visual Theatre","7 Cité Chaptal","75009","Paris","48.881325, 2.332942","gratuit","non","Tout public.","fr","December","2024","December","2024","Event","Ev-75009","kfevkg75","kfevkg75_2070"
"69862","https://www.paris.fr/evenements/atelier-concert-cordes-un-rest-in-time-modulor-quartet-69862","Atelier-concert : CORDES - \"*UN:REST* IN TIME\", Modulor Quartet","Assistez au concert \"*UN:REST* IN TIME\" du Quatuor Modulor, accompagné d'un atelier autour des cordes et d'un goûter après le spectacle !","Théâtre Dunois","7 Rue Louise Weiss","75013","Paris","48.8331800041875, 2.37054202816009","payant","conseillée","Public enfants, jeunes et adultes. A partir de 6 ans.","fr","February","2025","February","2025","Event","Ev-75013","kfevkg75","kfevkg75_1715"
"69864","https://www.paris.fr/evenements/atelier-concert-vents-et-electronique-calabasses-labs-une-rumeur-foisonnante-69864","Atelier-concert : VENTS ET ÉLECTRONIQUE - \"Calabasses Labs - une rumeur foisonnante\"","Assistons au concert \"Calabasses Labs - une rumeur foisonnante\" de Mario Lorenzo (L'Imaginaire), accompagné d'un atelier autour de l'accordéon et d'un goûter après le spectacle !","Théâtre Dunois","7 Rue Louise Weiss","75013","Paris","48.8331800041875, 2.37054202816009","payant","conseillée","Public enfants, jeunes et adultes. A partir de 6 ans.","fr","March","2025","March","2025","Event","Ev-75013","kfevkg75","kfevkg75_1444"
"69877","https://www.paris.fr/evenements/riquet-et-le-souhait-ridicule-69877","Riquet et le souhait ridicule","Redécouvrez trois histoires de Charles Perrault remises au goût du jour avec humour et poésie… Pour les enfants de 5 à 11 ans.","Théâtre Darius Milhaud","80 allée Darius Milhaud","75019","Paris","48.8859380077971, 2.39320803545098","payant","conseillée","Public enfants. A partir de 5 ans. Jusqu'à 11 ans.","fr","October","2024","November","2024","Event","Ev-75019","kfevkg75","kfevkg75_661"
"69884","https://www.paris.fr/evenements/le-pacte-69884","Le Pacte","Trompés par leurs conjoints respectifs, Catherine et Jean ont pris leur décision : ils ne se mettront plus jamais en couple !","Théâtre Darius Milhaud","80 allée Darius Milhaud","75019","Paris","48.8859380077971, 2.39320803545098","payant","conseillée","Public enfants, jeunes et adultes. A partir de 6 ans.","fr","October","2024","December","2024","Event","Ev-75019","kfevkg75","kfevkg75_596"
"69886","https://www.paris.fr/evenements/le-repaire-des-lucioles-69886","Le Repaire des lucioles","Et si le sommeil cessait d’exister ? Lorsque 5 inconnus partagent leurs nuits, les coeurs s’ouvrent, les liens se forment et l’espoir s’éveille…","Théâtre Darius Milhaud","80 allée Darius Milhaud","75019","Paris","48.8859380077971, 2.39320803545098","payant","conseillée","Public jeunes et adultes. A partir de 10 ans.","fr","October","2024","November","2024","Event","Ev-75019","kfevkg75","kfevkg75_1717"
"69889","https://www.paris.fr/evenements/monsieur-franck-69889","Monsieur Franck","Monsieur Franck, c’est un clown en marge de la société qui sort de sa cave avec l’espoir de se faire des amis. Entre rêve de quartier et réalité, il a plus d’un tour dans sa robe sale…","Théâtre Darius Milhaud","80 allée Darius Milhaud","75019","Paris","48.8859380077971, 2.39320803545098","payant","conseillée","Public enfants, jeunes et adultes. A partir de 6 ans.","fr","October","2024","December","2024","Event","Ev-75019","kfevkg75","kfevkg75_2007"
"69893","https://www.paris.fr/evenements/refaire-l-amour-la-comedie-romantique-dans-tout-ses-etats-temps-fort-du-mois-d-octobre-69893","Refaire l'amour, la comédie romantique dans tout ses états : Temps fort du mois d'Octobre","La comédie romantique est à l'honneur cet automne au Forum des images. Un genre ultra-codé, sur lequel pèsent bien des préjugés. Chambre d’écho de nos vies amoureuses, on peut se demander si l’avenir matrimonial qu’elle propose n’est pas une vision réactionnaire de l’amour. Et si, avec nos yeux de 2024, au temps de #MeToo, on réinterrogeait ce genre en profondeur pour re-faire l’amour ?","Forum des images","2 rue du Cinéma","75001","Paris","48.863415, 2.33677088600007","payant","conseillée","Tout public. Jusqu'à 2 ans.","fr","October","2024","November","2024","Event","Ev-75001","kfevkg75","kfevkg75_116"
"69896","https://www.paris.fr/evenements/dolce-folia-mourad-merzouki-69896","Dolce Folia - Mourad Merzouki","Les chorégraphies percutantes du génie du Hip Hop Mourad Merzouki fusionnent avec la finesse du Concert de l’Hostel Dieu pour former Dolce Folia.","Salle Gaveau","45 rue La Boetie","75008","Paris","48.8735280134126, 2.31419501933931","payant","conseillée","Public enfants, jeunes et adultes.","fr","November","2024","November","2024","Event","Ev-75008","kfevkg75","kfevkg75_2603"
"69897","https://www.paris.fr/evenements/stages-vacances-d-automne-au-centre-paris-anim-richard-wright-69897","Stages vacances d'automne au centre PAris Anim' Richard Wright","Nous voici sous les couleurs de l'automne avec les premières vacances de cette saison 2024/2025 qui approchent à grands pas …_x000D_\
En recherche d'inspiration pour occuper votre enfant, votre adolescent…voir même pour vous même ? _x000D_\
_x000D_\
Explorez la programmation des stages proposés au centre Paris Anim' Richard Wright ;o)","Centre Paris Anim' Richard Wright","76 bis rue de Rennes","75006","Paris","48.8509819930657, 2.3303760319624","payant","obligatoire","Public enfants, jeunes et adultes. A partir de 4 ans.","fr","October","2024","November","2024","Event","Ev-75006","kfevkg75","kfevkg75_2484"
"69899","https://www.paris.fr/evenements/le-noel-de-leon-brigitte-lecordier-69899","Le Noël de Léon - Brigitte LECORDIER","Plongez dans l’univers féérique du « Noël de Léon », un conte musical fantastique et humoristique raconté par Brigitte Lecordier","Salle Gaveau","45 rue La Boetie","75008","Paris","48.8735280134126, 2.31419501933931","payant","conseillée","Tout public.","fr","December","2024","December","2024","Event","Ev-75008","kfevkg75","kfevkg75_195"
"69937","https://www.paris.fr/evenements/reunion-d-information-sur-la-petite-enfance-dans-le-20e-69937","Réunion d’information sur la petite enfance dans le 20e","Les réunions d’information sont à destination des familles de l’arrondissement afin de présenter les différents modes d'accueil, collectif ou individuel et vous indiquer les démarches à suivre afin d’inscrire votre enfant dans le 20e arrondissement.","Mairie du 20e arrondissement","6 place Gambetta","75020","Paris","48.8650909992238, 2.39899800270749","gratuit","obligatoire","Tout public.","fr","October","2024","December","2024","Event","Ev-75020","kfevkg75","kfevkg75_1222"
"69951","https://www.paris.fr/evenements/stages-vacances-d-automne-halloween-pour-les-enfants-et-adolescent-e-s-69951","Stages vacances d'automne, Halloween, pour les enfants et adolescent·e·s","Des stages pour les enfants et les adolescent·e·s pendant les vacances d'automne 2024","Centre Paris Anim' Montparnasse","26, allée du Chef d'Escadron de Guillebon","75014","Paris","48.840269, 2.320449","payant","obligatoire","Public enfants et jeunes. A partir de 6 ans. Jusqu'à 17 ans.","fr","October","2024","October","2024","Event","Ev-75014","kfevkg75","kfevkg75_2604"
"69952","https://www.paris.fr/evenements/spectacle-pere-noel-sourd-69952","Spectacle Le Père Noël Sourd","L'association Père Noël Sourd vous invite à plonger dans la magie de Noël avec son spectacle familial accessible en LSF !","Médiathèque de la Canopée","10 passage de la Canopée","75001","Paris","48.862399, 2.346853","gratuit","obligatoire","Public enfants, jeunes et adultes. A partir de 6 ans.","fr","November","2024","November","2024","Event","Ev-75001","kfevkg75","kfevkg75_1732"
"69953","https://www.paris.fr/evenements/on-s-emerveille-avec-la-belle-et-la-bete-au-grand-hotel-des-reves-69953","On s'émerveille avec « La Belle et la Bête » au Grand Hôtel des Rêves","Le Grand Hôtel des Rêves propose une expérience théâtrale immersive unique. L'idée ? Suivre les acteurs de salle en salle pour plonger un peu plus dans la magie du conte de « La Belle et la Bête ». On a poussé la porte du château, on vous raconte !","Le Grand Hôtel des rêves","47 rue du Cardinal Lemoine","75005","Paris","48.8470440073158, 2.35247500350349","payant","obligatoire","Public enfants, jeunes et adultes.","fr","September","2024","November","2024","Event","Ev-75005","kfevkg75","kfevkg75_840"
"69954","https://www.paris.fr/evenements/concert-de-noel-69954","Concert de Noël","Conçu comme une joyeuse farandole, ce concert nous entraîne dans le riche cortège des rois mages en route vers Bethleem.","Église Saint-François-de-Sales","15, rue Ampère","75017","Paris","48.8851180062094, 2.30511599327676","payant","conseillée","Tout public.","fr","December","2024","December","2024","Event","Ev-75017","kfevkg75","kfevkg75_2074"
"69955","https://www.paris.fr/evenements/ca-tourne-69955","Ça tourne !","Sans que nous n'y prenions garde, les musiques choisies par les cinéastes agissent puissamment en nous. Elles nous entraînent dans l'action et augmentent nos émotions…","Cirque d'Hiver","110, rue Amelot","75011","Paris","48.8631240180056, 2.36727501375938","payant","conseillée","Tout public.","fr","May","2025","June","2025","Event","Ev-75011","kfevkg75","kfevkg75_886"
"69957","https://www.paris.fr/evenements/spectacle-des-chouettes-conteuses-69957","Spectacle des Chouettes Conteuses","Invitées par la bibliothèque à participer au temps fort sur l’oralité dans le réseau parisien, les Chouettes Conteuses nous font le plaisir de venir du 92 pour raconter leurs histoires !","Bibliothèque Colette Vivier","6 rue Fourneyron","75017","Paris","48.8897829963312, 2.31964300494624","gratuit","obligatoire","Public enfants, jeunes et adultes. A partir de 4 ans.","fr","November","2024","November","2024","Event","Ev-75017","kfevkg75","kfevkg75_917"
"69959","https://www.paris.fr/evenements/andersen-lu-par-les-livreurs-a-la-maison-du-danemark-69959","Andersen, lu par les livreurs à la Maison du Danemark","La Maison du Danemark ouvre ses portes aux petits et grands enfants pour une plongée sonore dans l’univers enchanté des contes de fées d’Andersen !","Maison du Danemark","142 avenue des Champs-Élysées","75008","Paris","48.8729469798845, 2.29879603828246","payant","obligatoire","Public enfants, jeunes et adultes. A partir de 8 ans.","fr","October","2024","December","2024","Event","Ev-75008","kfevkg75","kfevkg75_885"
"69960","https://www.paris.fr/evenements/jeune-public-une-lumiere-pour-noel-69960","[Jeune public] Une lumière pour Noël","Venez retrouver la magie de Noël avec P’tit bout ! Un conte plein de fantaisie et de poésie inspiré des différents symboles de Noël.","Théâtre le Funambule Montmartre","53 rue des Saules","75018","Paris","48.8907509804195, 2.34041595940496","payant","conseillée","Tout public.","fr","November","2024","January","2025","Event","Ev-75018","kfevkg75","kfevkg75_884"
"69966","https://www.paris.fr/evenements/exposition-arte-povera-69966","Exposition : Arte Povera","À partir du 9 octobre 2024, Pinault Collection présente à la Bourse de Commerce, une exposition d’envergure dédiée à l’Arte Povera. Entre héritage et influence, l’exposition traverse plus de 250 œuvres historiques, contemporaines, et issues de ce courant artistique italien majeur des années 1960.","Bourse de Commerce — Pinault Collection","2 rue de Viarmes","75001","Paris","48.8629459863822, 2.34240003970564","payant","conseillée","Public enfants, jeunes et adultes. A partir de 6 ans.","fr","October","2024","January","2025","Event","Ev-75001","kfevkg75","kfevkg75_1720"
"69967","https://www.paris.fr/evenements/stephen-jones-chapeaux-d-artiste-au-palais-galliera-69967","Stephen Jones, chapeaux d’artiste au Palais Galliera","L’exposition Stephen Jones, chapeaux d’artiste au Palais Galliera présente l'œuvre de ce créateur britannique, sans conteste l’un des plus grands modistes contemporains, de ses premières collections dans les années 1980 jusqu’aux plus récentes.","Square du Palais Galliera - Musée de la Mode de la Ville de Paris","14 Avenue du Président Wilson","75016","Paris","48.8651739800652, 2.29813202391293","payant","conseillée","Tout public.","fr","October","2024","March","2025","Event","Ev-75016","kfevkg75","kfevkg75_839"
"69974","https://www.paris.fr/evenements/atelier-d-ecriture-69974","Atelier d'écriture","Animée par les médiatrices et médiateurs de la Bourse de Commerce, cette session d'écriture collective vous fera imaginer les mots pour décrire, entendre et partager les œuvres exposées.","Bourse de Commerce — Pinault Collection","2 rue de Viarmes","75001","Paris","48.8629459863822, 2.34240003970564","gratuit","obligatoire","Public adultes. A partir de 18 ans. Jusqu'à 26 ans.","fr","November","2024","November","2024","Event","Ev-75001","kfevkg75","kfevkg75_2235"
"69990","https://www.paris.fr/evenements/stages-les-vacances-d-automne-2024-69990","STAGES | Les vacances d'automne 2024","Tout un programme pour petit·es et grand·es à découvrir au Centre Paris Anim' Mado Robin","Centre Paris Anim’ Mado Robin","84 rue Mstislav Rostropovitch","75017","Paris","48.8919280091729, 2.31029198612566","payant","obligatoire","Public enfants, jeunes et adultes. A partir de 5 ans.","fr","October","2024","November","2024","Event","Ev-75017","kfevkg75","kfevkg75_1063"
"69996","https://www.paris.fr/evenements/le-samedi-des-enfants-69996","Le samedi des enfants","Des contes, des lectures et des comptines pour les 0-_x000D_\
6 ans","Médiathèque Françoise Sagan","8 rue Léon Schwartzenberg","75010","Paris","48.8755965903869, 2.35389596112724","gratuit","non","Public tout-petits et enfants.","fr","November","2024","December","2024","Event","Ev-75010","kfevkg75","kfevkg75_2011"
