"67969","https://www.paris.fr/evenements/des-soirees-d-opera-au-musee-jacquemart-andre-67969","Des soirées d’opéra au Musée Jacquemart-André","Une expérience unique et inoubliable au plus près des artistes.","Musée Jacquemart-André","158, boulevard Haussmann","75008","Paris","48.8752649952077, 2.31087301965377","payant","obligatoire","Tout public.","fr","September","2024","June","2025","Event","Ev-75008","kfevkg75","kfevkg75_1370"
"67972","https://www.paris.fr/evenements/pister-les-creatures-fabuleuses-jeu-de-piste-theatro-philosophique-pour-toute-la-famille-au-theatre-silvia-monfort-67972","Pister les créatures fabuleuses, jeu de piste théâtro-philosophique pour toute la famille au Théâtre Silvia Monfort","Pister, c'est relever la trace d'un animal et suivre ses empreintes pour en percer tous les secrets.","Théâtre Silvia Monfort","106 rue Brancion","75015","Paris","48.8303029997415, 2.3018189716627","payant","conseillée","Public enfants, jeunes et adultes. A partir de 7 ans.","fr","December","2024","December","2024","Event","Ev-75015","kfevkg75","kfevkg75_634"
"67979","https://www.paris.fr/evenements/primordial-laboratoire-de-la-pulsation-au-theatre-silvia-monfort-67979","Primordial : laboratoire de la pulsation au Théâtre Silvia Monfort","Pour vivre une véritable mise à l’épreuve du rythme.","Théâtre Silvia Monfort","106 rue Brancion","75015","Paris","48.8303029997415, 2.3018189716627","payant","conseillée","Tout public.","fr","January","2025","January","2025","Event","Ev-75015","kfevkg75","kfevkg75_1263"
"67981","https://www.paris.fr/evenements/les-quatre-points-cardinaux-sont-trois-ou-comment-conjuguer-poesie-et-acrobatie-au-theatre-silvia-monfort-67981","Les quatre points cardinaux sont trois, ou comment conjuguer poésie et acrobatie au Théâtre Silvia Monfort","Entre acrobatie et poésie, une fiction saisissante qui donne vie à une maison en ruine.","Théâtre Silvia Monfort","106 rue Brancion","75015","Paris","48.8303029997415, 2.3018189716627","payant","conseillée","Public enfants, jeunes et adultes. A partir de 12 ans.","fr","January","2025","January","2025","Event","Ev-75015","kfevkg75","kfevkg75_1410"
"67982","https://www.paris.fr/evenements/avale-moi-si-tu-peux-67982","Avale-moi si tu peux !","Dans le cadre du temps fort Les mots à la bouche, la littérature orale dans les bibliothèques de la Ville de Paris","Médiathèque Marguerite Duras","115, rue de Bagnolet","75020","Paris","48.8598389825131, 2.40322700813562","gratuit","non","Public enfants et adultes. A partir de 3 ans.","fr","November","2024","November","2024","Event","Ev-75020","kfevkg75","kfevkg75_2340"
"67984","https://www.paris.fr/evenements/howl-2122-ode-a-la-jeunesse-sous-forme-de-slam-theatral-au-theatre-silvia-monfort-67984","Howl 2122, ode à la jeunesse sous forme de slam théâtral au Théâtre Silvia Monfort","\"En France, on a enfermé la jeunesse universitaire pendant plus d’un an.\"","Théâtre Silvia Monfort","106 rue Brancion","75015","Paris","48.8303029997415, 2.3018189716627","payant","conseillée","Public enfants, jeunes et adultes. A partir de 11 ans.","fr","February","2025","February","2025","Event","Ev-75015","kfevkg75","kfevkg75_992"
"67985","https://www.paris.fr/evenements/circus-remake-cirque-festif-et-inventif-au-theatre-silvia-monfort-67985","Circus Remake, cirque festif et inventif au Théâtre Silvia Monfort","Un cirque haut en couleur, décalé et joyeux !","Théâtre Silvia Monfort","106 rue Brancion","75015","Paris","48.8303029997415, 2.3018189716627","payant","conseillée","Public enfants, jeunes et adultes. A partir de 8 ans.","fr","February","2025","February","2025","Event","Ev-75015","kfevkg75","kfevkg75_1408"
"67987","https://www.paris.fr/evenements/trolls-d-ogresse-67987","Trolls d'Ogresse","Dans le cadre du temps fort Les mots à la bouche, la littérature orale dans les bibliothèques de la Ville de Paris","Médiathèque Marguerite Duras","115, rue de Bagnolet","75020","Paris","48.8598389825131, 2.40322700813562","gratuit","non","Public enfants, jeunes et adultes. A partir de 8 ans.","fr","December","2024","December","2024","Event","Ev-75020","kfevkg75","kfevkg75_1426"
"67990","https://www.paris.fr/evenements/art-r-2024-assemblee-de-la-compagnie-sauf-le-dimanche-67990","Art'R 2024 / « Assemblée » de la compagnie Sauf le Dimanche","Sortie de résidence d' « Assemblée », de la compagnie Sauf le Dimanche dans le cadre d'Art'R - Saison des arts de la rue - Automne 2024.","Parvis de la mairie du 11e et Place Léon Blum","Place Léon Blum","75011","Paris","48.857963795605, 2.37999351383512","gratuit","non","Public jeunes.","fr","November","2024","November","2024","Event","Ev-75011","kfevkg75","kfevkg75_1180"
"67993","https://www.paris.fr/evenements/academie-fratellini-creation-collective-des-apprenti-e-s-de-l-ecole-de-cirque-au-theatre-silvia-monf-67993","Académie Fratellini : création collective des apprenti·e·s de l’école de cirque au Théâtre Silvia MOnf","Au tour des élèves de nous montrer de quoi ils sont capables !","Théâtre Silvia Monfort","106 rue Brancion","75015","Paris","48.8303029997415, 2.3018189716627","payant","conseillée","Public enfants, jeunes et adultes. A partir de 8 ans.","fr","March","2025","March","2025","Event","Ev-75015","kfevkg75","kfevkg75_1129"
"67995","https://www.paris.fr/evenements/ware-mono-quand-la-danse-sublime-les-failles-un-spectacle-a-voir-en-famille-au-theatre-silvia-monfort-67995","Waré Mono, quand la danse sublime les failles : un spectacle à voir en famille au Théâtre Silvia Monfort","Recoller les morceaux et les sublimer. Durée 45min.","Théâtre Silvia Monfort","106 rue Brancion","75015","Paris","48.8303029997415, 2.3018189716627","payant","conseillée","Public enfants, jeunes et adultes. A partir de 6 ans.","fr","March","2025","March","2025","Event","Ev-75015","kfevkg75","kfevkg75_1265"
"67996","https://www.paris.fr/evenements/iterations-tours-de-passe-passe-corporel-au-theatre-silvia-monfort-67996","Iterations, tours de passe-passe corporel au Théâtre Silvia Monfort","Dans Iterations, rien n'est impossible !","Théâtre Silvia Monfort","106 rue Brancion","75015","Paris","48.8303029997415, 2.3018189716627","payant","conseillée","Tout public.","fr","March","2025","March","2025","Event","Ev-75015","kfevkg75","kfevkg75_2270"
"67999","https://www.paris.fr/evenements/zonder-numero-choregraphique-jubilatoire-au-theatre-silvia-monfort-67999","Zonder, numéro chorégraphique jubilatoire au Théâtre Silvia Monfort","Une ode dansée à l'irrationnel et à la joie.","Théâtre Silvia Monfort","106 rue Brancion","75015","Paris","48.8303029997415, 2.3018189716627","payant","conseillée","Public enfants, jeunes et adultes. A partir de 11 ans.","fr","March","2025","March","2025","Event","Ev-75015","kfevkg75","kfevkg75_1414"
"68000","https://www.paris.fr/evenements/taranto-aleatorio-spectacle-de-flamenco-drole-et-fievreux-au-theatre-silvia-monfort-68000","Taranto Aleatorio, spectacle de flamenco drôle et fiévreux au Théâtre Silvia Monfort","Un spectacle de flamenco drôle et fiévreux !","Théâtre Silvia Monfort","106 rue Brancion","75015","Paris","48.8303029997415, 2.3018189716627","payant","conseillée","Tout public.","fr","March","2025","March","2025","Event","Ev-75015","kfevkg75","kfevkg75_2699"
"68003","https://www.paris.fr/evenements/by-heart-une-experience-theatrale-autour-de-la-memoire-a-vivre-au-theatre-silvia-monfort-68003","By Heart, une expérience théâtrale autour de la mémoire à vivre au Théâtre Silvia Monfort","Mais que signifie au juste « apprendre un texte par cœur » ?","Théâtre Silvia Monfort","106 rue Brancion","75015","Paris","48.8303029997415, 2.3018189716627","payant","conseillée","Tout public.","fr","March","2025","March","2025","Event","Ev-75015","kfevkg75","kfevkg75_1773"
"68012","https://www.paris.fr/evenements/morphing-boum-pour-enfants-au-theatre-silvia-monfort-68012","Morphing, boum pour enfants au Théâtre Silvia Monfort","Un dancefloor pour les petits et les grands !","Théâtre Silvia Monfort","106 rue Brancion","75015","Paris","48.8303029997415, 2.3018189716627","payant","conseillée","Tout public.","fr","March","2025","March","2025","Event","Ev-75015","kfevkg75","kfevkg75_635"
"68014","https://www.paris.fr/evenements/16-levers-de-soleil-cine-concert-au-theatre-silvia-monfort-68014","16 Levers de soleil, ciné-concert au Théâtre Silvia Monfort","Bienvenue à bord du vaisseau de Thomas Pesquet.","Théâtre Silvia Monfort","106 rue Brancion","75015","Paris","48.8303029997415, 2.3018189716627","payant","conseillée","Public enfants, jeunes et adultes. A partir de 8 ans.","fr","April","2025","April","2025","Event","Ev-75015","kfevkg75","kfevkg75_1691"
"68046","https://www.paris.fr/evenements/uto-68046","UTO","When all you want to do is be the fire part of fire… répétez ces paroles sans cesse tel un mantra, comme les UTO l’ont fait.","La Gaîté Lyrique","3 bis Rue Papin","75003","Paris","48.8667047, 2.35376780000001","payant","obligatoire","Public enfants, jeunes et adultes.","fr","December","2024","December","2024","Event","Ev-75003","kfevkg75","kfevkg75_2387"
"68070","https://www.paris.fr/evenements/sarabande-manege-musical-au-theatre-silvia-monfort-68070","Sarabande, manège musical au Théâtre Silvia Monfort","Quand la musique et le cirque se rencontrent…","Théâtre Silvia Monfort","106 rue Brancion","75015","Paris","48.8303029997415, 2.3018189716627","payant","conseillée","Public enfants, jeunes et adultes. A partir de 8 ans.","fr","April","2025","April","2025","Event","Ev-75015","kfevkg75","kfevkg75_793"
"68073","https://www.paris.fr/evenements/loco-spectacle-de-marionnettes-absurde-et-surrealiste-au-theatre-silvia-monfort-68073","Loco, spectacle de marionnettes absurde et surréaliste au Théâtre Silvia Monfort","Un conte absurde et surréaliste incarné par deux comédiennes et une marionnette.","Théâtre Silvia Monfort","106 rue Brancion","75015","Paris","48.8303029997415, 2.3018189716627","payant","conseillée","Tout public.","fr","May","2025","May","2025","Event","Ev-75015","kfevkg75","kfevkg75_537"
"68078","https://www.paris.fr/evenements/une-ombre-vorace-epopee-theatrale-alpine-entre-fiction-et-realite-au-theatre-silvia-monfort-68078","Une Ombre vorace, épopée théâtrale alpine entre fiction et réalité au Théâtre Silvia Monfort","Une épopée alpine entre fiction et réalité.","Théâtre Silvia Monfort","106 rue Brancion","75015","Paris","48.8303029997415, 2.3018189716627","payant","conseillée","Tout public.","fr","May","2025","May","2025","Event","Ev-75015","kfevkg75","kfevkg75_2461"
"68086","https://www.paris.fr/evenements/sillages-quand-les-souvenirs-rebondissent-cirque-au-theatre-silvia-monfort-68086","Sillages, quand les souvenirs rebondissent : cirque au Théâtre Silvia Monfort","Quand le cirque devient une formidable matière documentaire et poétique.","Théâtre Silvia Monfort","106 rue Brancion","75015","Paris","48.8303029997415, 2.3018189716627","payant","conseillée","Tout public.","fr","May","2025","May","2025","Event","Ev-75015","kfevkg75","kfevkg75_637"
"68087","https://www.paris.fr/evenements/imperial-orpheon-bal-festif-au-theatre-silvia-monfort-68087","Impérial Orphéon, bal festif au Théâtre Silvia Monfort","Un bal jazz en mai au Théâtre Silvia Monfort… On se rejoint sur le dancefloor ?","Théâtre Silvia Monfort","106 rue Brancion","75015","Paris","48.8303029997415, 2.3018189716627","payant","conseillée","Public enfants, jeunes et adultes. A partir de 5 ans.","fr","May","2025","May","2025","Event","Ev-75015","kfevkg75","kfevkg75_636"
"68089","https://www.paris.fr/evenements/p-tit-bonhomme-cie-68089","P’tit Bonhomme & Cie","Dans le cadre du temps fort Des mots à la bouche, la littérature orale dans les bibliothèques de la Ville de Paris, Pierre Delye vient raconter à la médiathèque pour toute la famille","Médiathèque Jean-Pierre Melville","79 rue Nationale","75013","Paris","48.826787000907, 2.36644000856506","gratuit","obligatoire","Public enfants. A partir de 5 ans.","fr","November","2024","November","2024","Event","Ev-75013","kfevkg75","kfevkg75_626"
"68095","https://www.paris.fr/evenements/jubila-solo-clownesque-au-theatre-silvia-monfort-68095","Jubilä, solo clownesque au Théâtre Silvia Monfort","Un solo au carrefour du chant, du théâtre, de la musique et du clown.","Théâtre Silvia Monfort","106 rue Brancion","75015","Paris","48.8303029997415, 2.3018189716627","payant","conseillée","Tout public.","fr","June","2025","June","2025","Event","Ev-75015","kfevkg75","kfevkg75_1689"
"68097","https://www.paris.fr/evenements/trouble-quintet-deconcertant-a-decouvrir-au-theatre-silvia-monfort-68097","Trouble, quintet déconcertant à découvrir au Théâtre Silvia Monfort","Un concert aux sonorités troublantes qui nous ouvre grand la porte de l'imaginaire.","Théâtre Silvia Monfort","106 rue Brancion","75015","Paris","48.8303029997415, 2.3018189716627","payant","conseillée","Public enfants, jeunes et adultes. A partir de 5 ans.","fr","June","2025","June","2025","Event","Ev-75015","kfevkg75","kfevkg75_1264"
"68113","https://www.paris.fr/evenements/exposition-collective-nouveau-regard-une-exploration-photographique-68113","Exposition collective « Nouveau Regard, une exploration photographique »","Cette exposition fait se croiser dix regards sur différentes problématiques que peut soulever_x000D_\
la photographie aujourd’hui. Les thèmes abordés sont variés, allant du portrait intime à la nature morte, en passant par la mise en scène plus créative ou des explorations plus abstraites._x000D_\
_x000D_\
Un commissariat de Catherine Rebois.","Conservatoire Municipal Charles Münch","7, rue Duranti","75011","Paris","48.860888019605, 2.38436495996282","gratuit","non","Tout public.","fr","September","2024","November","2024","Event","Ev-75011","kfevkg75","kfevkg75_273"
"68115","https://www.paris.fr/evenements/la-mediatheque-fete-ses-cinquante-ans-68115","La médiathèque fête ses cinquante ans !","À l'occasion du cinquantenaire de la médiathèque (1974-2024), les bibliothécaires vous ont concocté une programmation pleine de surprises.","Médiathèque Violette Leduc","18 rue Faidherbe","75011","Paris","48.8515960093828, 2.38396003022044","gratuit","non","Tout public.","fr","October","2024","December","2024","Event","Ev-75011","kfevkg75","kfevkg75_55"
"68121","https://www.paris.fr/evenements/journee-mondiale-du-kamishibai-a-la-bibliotheque-aime-cesaire-68121","Journée mondiale du Kamishibaï à la bibliothèque Aimé Césaire","Venez découvrir ce « théâtre de papier », originaire du Japon et écoutez les histoires lues par les bibliothécaires.","Bibliothèque Aimé Césaire","5 rue de Ridder","75014","Paris","48.8312310021516, 2.31166200819968","gratuit","non","Public tout-petits et enfants.","fr","December","2024","December","2024","Event","Ev-75014","kfevkg75","kfevkg75_2512"
"68122","https://www.paris.fr/evenements/entrez-dans-la-ronde-des-contes-avec-nathalie-leone-68122","Entrez dans la Ronde des Contes avec Nathalie Leone","Les mots et les idées se mélangent… et finissent en histoires._x000D_\
Tous en rond, les parents et les enfants échangent des mots et on joue à se raconter des histoires.","Bibliothèque François Villon","81, boulevard de la Villette","75010","Paris","48.8772049866976, 2.37079700565468","gratuit","obligatoire","Public enfants, jeunes et adultes. A partir de 8 ans.","fr","December","2024","December","2024","Event","Ev-75010","kfevkg75","kfevkg75_1394"
"68123","https://www.paris.fr/evenements/seance-d-improvisation-inventons-des-histoires-avec-la-conteuse-nathalie-leone-68123","Séance d'improvisation : Inventons des histoires avec la conteuse Nathalie Leone","Stimulez votre imaginaire dans la bonne humeur en laissant place à votre créativité !","Bibliothèque François Villon","81, boulevard de la Villette","75010","Paris","48.8772049866976, 2.37079700565468","gratuit","obligatoire","Public enfants, jeunes et adultes. A partir de 8 ans.","fr","December","2024","December","2024","Event","Ev-75010","kfevkg75","kfevkg75_1848"
"68133","https://www.paris.fr/evenements/soiree-jeux-de-societe-68133","Soirée jeux de société","Vous aimez bâtir des mondes, vous battre à l'épée, déjouer des pièges, tricher (juste un peu), lancer des dés et peut-être… gagner ? Venez !","Médiathèque Marguerite Yourcenar","41, rue d'Alleray","75015","Paris","48.83680697942, 2.30348101924335","gratuit","obligatoire","Public enfants, jeunes et adultes. A partir de 6 ans.","fr","November","2024","November","2024","Event","Ev-75015","kfevkg75","kfevkg75_2720"
"68136","https://www.paris.fr/evenements/balade-naturaliste-au-parc-georges-brassens-68136","Balade naturaliste au parc Georges Brassens","Venez suivre les traces des oiseaux au parc Georges Brassens en compagnie de la Ligue de Protection des Oiseaux. En partenariat avec le théâtre Silvia Monfort.","Médiathèque Marguerite Yourcenar","41, rue d'Alleray","75015","Paris","48.83680697942, 2.30348101924335","gratuit","obligatoire","Tout public.","fr","December","2024","December","2024","Event","Ev-75015","kfevkg75","kfevkg75_1917"
"68154","https://www.paris.fr/evenements/paris-sport-familles-bougez-en-famille-a-la-piscine-emile-anthoine-68154","Paris sport familles : Bougez en famille à la piscine Emile Anthoine","Une offre qui permet aux parents et à leurs enfants âgés de 3 à 7 ans de pratiquer diverses activités gratuitement, les samedis et dimanches, sans nécessité de réservation préalable. Cette offre exclusive est réservée aux familles parisiennes.","Piscine Emile Anthoine","9, rue Jean Rey","75015","Paris","48.8554699993019, 2.29100799294702","gratuit sous condition","non","Tout public.","fr","September","2024","July","2025","Event","Ev-75015","kfevkg75","kfevkg75_755"
"68163","https://www.paris.fr/evenements/paris-sport-familles-multisports-au-gymnase-atlas-68163","Paris sport familles : multisports au gymnase Atlas","Une offre qui permet aux parents et à leurs enfants âgés de 3 à 7 ans de pratiquer diverses activités gratuitement, les samedis et dimanches, sans nécessité de réservation préalable. Cette offre exclusive est réservée aux familles parisiennes.","Gymnase Atlas","18 Bis rue de l’Atlas","75019","Paris","48.8757109962756, 2.37667297123775","gratuit","non","Tout public. A partir de 3 ans. Jusqu'à 7 ans.","fr","September","2024","July","2025","Event","Ev-75019","kfevkg75","kfevkg75_1183"
"68165","https://www.paris.fr/evenements/paris-sport-familles-motricite-coordination-au-gymnase-paul-meurice-68165","Paris sport familles : motricité/coordination au gymnase Paul Meurice","Une offre qui permet aux parents et à leurs enfants âgés de 3 à 7 ans de pratiquer diverses activités gratuitement, les samedis et dimanches, sans nécessité de réservation préalable. Cette offre exclusive est réservée aux familles parisiennes.","Centre Sportif Paul Meurice","1 rue Paul  Meurice","75020","Paris","48.8740269881087, 2.41213797703949","gratuit","non","Public enfants. A partir de 3 ans. Jusqu'à 6 ans.","fr","September","2024","July","2025","Event","Ev-75020","kfevkg75","kfevkg75_1704"
"68176","https://www.paris.fr/evenements/visite-contee-le-murmure-des-couleurs-68176","Visite contée : Le murmure des couleurs","Guidés par la conteuse Laure Urgin, découvrez en famille l'exposition « La couleur parle toutes les langues. Œuvres choisies de la Collection Al Thani » à l'Hôtel de la Marine !","Hôtel de la Marine","2, place de la Concorde","75008","Paris","48.8667269790856, 2.32293902073192","payant","obligatoire","Public enfants, jeunes et adultes. A partir de 4 ans.","fr","November","2024","January","2025","Event","Ev-75008","kfevkg75","kfevkg75_1109"
"68187","https://www.paris.fr/evenements/matchs-gratuits-du-paris-fc-pour-la-saison-2024-2025-le-programme-complet-68187","Matchs gratuits du Paris FC pour la saison 2024-2025, le programme complet","Après le succès de son initiative en 2023-2024, le Paris FC a décidé de proposer à nouveau la gratuité de toutes ses rencontres à domicile, au stade Charléty (13e), pour la saison 2024-2025. Voici les matchs concernés.","Stade Sébastien Charléty","99, Boulevard Kellermann","75013","Paris","48.8192240096718, 2.34554803108122","gratuit","obligatoire","Tout public.","fr","September","2024","May","2025","Event","Ev-75013","kfevkg75","kfevkg75_282"
"68213","https://www.paris.fr/evenements/nancy-and-the-ramblers-sur-seine-a-la-peniche-marcounet-68213","Nancy and The Ramblers sur Seine à La Peniche Marcounet","Nancy and The Ramblers propose une soirée de jazz-ballades au Marcounet !","Peniche Marcounet","14 Quai de l'Hôtel de ville","75004","Paris","48.8530857, 2.3573881","payant","obligatoire","Tout public.","fr","November","2024","November","2024","Event","Ev-75004","kfevkg75","kfevkg75_1572"
"68214","https://www.paris.fr/evenements/le-vivier-x-theatre-el-duende-en-route-pour-une-4eme-edition-68214","Le Vivier X Théâtre El Duende : En route pour une 4ème édition","Le festival Vivier X Théâtre El Duende revient les 23 et 24 novembre 2024 pour une 4ème édition, explorant inclusion, écologie et féminisme sous le thème « De Soi à l'Autre ».","Théâtre El Duende","23 Rue Hoche","94200","Ivry-sur-Seine","48.8109979, 2.3781658","payant","obligatoire","Tout public.","fr","November","2024","November","2024","Event","Ev-94200","kfevkg75","kfevkg75_26"
"68215","https://www.paris.fr/evenements/jacques-vidal-quintette-les-fables-de-mingus-au-son-de-la-terre-68215","Jacques Vidal Quintette - Les Fables de Mingus au Son de la Terre","Etonnant comme cette musique touche au cœur, frappe au plexus, dégage énergie et swing; une musique black, irriguée de soul et nourrie au gospel !","Le Son de la Terre","2 Port de Montebello","75005","Paris","48.851503, 2.351091","payant","obligatoire","Tout public.","fr","November","2024","November","2024","Event","Ev-75005","kfevkg75","kfevkg75_1371"
"68216","https://www.paris.fr/evenements/nicolas-torracinta-gilles-barikosky-quartet-lento-au-son-de-la-terre-68216","Nicolas Torracinta Gilles Barikosky quartet Lento au Son de la Terre","Un jazz urbain façonné par de la musique du monde en quelques sortes.","Le Son de la Terre","2 Port de Montebello","75005","Paris","48.851503, 2.351091","payant","obligatoire","Tout public.","fr","November","2024","November","2024","Event","Ev-75005","kfevkg75","kfevkg75_1705"
"68217","https://www.paris.fr/evenements/torkestra-au-baiser-sale-68217","Torkestra au Baiser Salé","Du jazz, du funk,du blues et du R'n'B !","Le Baiser Salé","58 Rue des Lombards","75001","Paris","48.8598354, 2.3478728","payant","obligatoire","Tout public.","fr","November","2024","November","2024","Event","Ev-75001","kfevkg75","kfevkg75_348"
"68218","https://www.paris.fr/evenements/an-evening-with-the-joan-minor-quartet-au-son-de-la-terre-68218","An Evening with the Joan Minor Quartet au Son de la Terre","Le Joan Minor Quartet conjugue le style américain de Joan avec le talent d'un groupe de français. Grâce à un répertoire aux multiples facettes ils ont suscité l'enthousiasme de leur public en Europe.","Le Son de la Terre","2 Port de Montebello","75005","Paris","48.851503, 2.351091","payant","obligatoire","Tout public.","fr","November","2024","November","2024","Event","Ev-75005","kfevkg75","kfevkg75_2557"
"68219","https://www.paris.fr/evenements/who-parked-the-car-au-son-de-la-terre-68219","Who Parked The Car au Son de la Terre","Who Parked The Car mélange habilement les genres musicaux, allant de la Neo-Soul au Jazz en passant par le Funk et l’Electro.","Le Son de la Terre","2 Port de Montebello","75005","Paris","48.851503, 2.351091","payant","obligatoire","Tout public.","fr","December","2024","December","2024","Event","Ev-75005","kfevkg75","kfevkg75_518"
"68220","https://www.paris.fr/evenements/girl-scout-en-concert-au-supersonic-68220","Girl Scout en concert au Supersonic","Il faut venir si vous êtes fans de… Alvvays, Courtney Barnet & Frankie Cosmos !","SUPERSONIC","9 Rue Biscornet","75012","Paris","48.8502469839762, 2.36970702296574","gratuit","conseillée","Tout public.","fr","April","2025","April","2025","Event","Ev-75012","kfevkg75","kfevkg75_2442"
"68225","https://www.paris.fr/evenements/fogg-x-mezinc-a-la-dame-de-canton-68225","FOGG x MÉZINC à La Dame de Canton","Mettez un chanteur à la présence scénique espiègle et un musicien passionné de synthétiseurs…","La Dame de Canton","Quai François Mauriac","75013","Paris","48.8337007097739, 2.37785419904316","payant","obligatoire","Tout public.","fr","November","2024","November","2024","Event","Ev-75013","kfevkg75","kfevkg75_2207"
"68226","https://www.paris.fr/evenements/straight-arrows-spaghetti-sluts-mont-loser-l-inter-hors-les-murs-au-sample-68226","Straight Arrows + Spaghetti Sluts + Mont Loser (L'Inter Hors les Murs au Sample)","Suite à la fermeture de l'Inter pour travaux, on vous propose une nouvelle soirée Hors Les Murs au Sample.","Le Sample","18 Avenue de la République","93170","Bagnolet","48.8628075, 2.414986","payant","obligatoire","Tout public.","fr","November","2024","November","2024","Event","Ev-93170","kfevkg75","kfevkg75_2208"
"68227","https://www.paris.fr/evenements/junodream-en-concert-au-supersonic-68227","junodream en concert au Supersonic","Cette soirée plaira aux fans de… Pink Floyd, Air & Spiritualized !","SUPERSONIC","9 Rue Biscornet","75012","Paris","48.8502469839762, 2.36970702296574","gratuit","non","Tout public.","fr","November","2024","November","2024","Event","Ev-75012","kfevkg75","kfevkg75_1184"
