"64145","https://www.paris.fr/evenements/ateliers-en-duo-parent-enfant-danse-yoga-3-6-ans-64145","Ateliers en duo parent-enfant Danse-Yoga 3-6 ans","Ateliers en famille dès 3 ans!_x000D_\
_x000D_\
Dimanche 11h-12h_x000D_\
_x000D_\
Renseignements: www.compagniemaya.com_x000D_\
_x000D_\
contact@compagniemaya.com ou 06 12 96 65 98","Studio DTM","6 rue de la Folie-Méricourt, 75011 Paris","75011","Paris","48.86153598263, 2.37471797614111","payant","obligatoire","Public tout-petits et enfants. A partir de 3 ans. Jusqu'à 6 ans.","fr","November","2024","November","2024","Event","Ev-75011","kfevkg75","kfevkg75_2214"
"64205","https://www.paris.fr/evenements/carte-blanche-a-la-photographe-amira-al-sharif-exposition-64205","Carte blanche à la photographe Amira Al-Sharif - Exposition","Il est des rencontres singulières qui vous marquent à jamais…_x000D_\
Des rencontres qui vous invitent au voyage et au partage par-delà les différences et les frontières…_x000D_\
Celle que nous fîmes avec la photographe Amira Al-Sharif, artiste engagée en exil à Paris, fut au nombre de celles-ci…_x000D_\
Et c’est parce que nous avons été émus, émerveillés, que nous vous convions à découvrir son travail au travers d’une exposition de photographies, témoins précieux de la vie au cœur d’un Yémen ravagé.","Bibliothèque Arthur Rimbaud","2 place Baudoyer","75004","Paris","48.8561879931279, 2.35569298377061","gratuit","non","Tout public.","fr","December","2024","January","2025","Event","Ev-75004","kfevkg75","kfevkg75_1846"
"64222","https://www.paris.fr/evenements/resonance-interieure-exposition-de-jade-padey-64222","Résonance intérieure : exposition de Jade Padey","La bibliothèque Saint-Éloi accueille l'artiste Jade Padey pour une exposition, un vernissage et un atelier autour de la pratique du collage.","Bibliothèque Saint-Eloi","23 rue du Colonel Rozanoff","75012","Paris","48.8455290202263, 2.38711103908116","gratuit","non","Tout public.","fr","October","2024","November","2024","Event","Ev-75012","kfevkg75","kfevkg75_2170"
"64229","https://www.paris.fr/evenements/le-temps-des-histoires-64229","Le temps des histoires","Chaque premier samedi du mois, retrouvez vos bibliothécaires préféré•es pour une heure d'histoires en tout genre au sein de la section jeunesse","Bibliothèque Couronnes - Naguib Mahfouz","66 rue des Couronnes","75020","Paris","48.8701419787808, 2.3851650819573","gratuit","non","Public tout-petits.","fr","September","2024","July","2025","Event","Ev-75020","kfevkg75","kfevkg75_1806"
"64248","https://www.paris.fr/evenements/l-heure-du-conte-des-tout-petits-64248","L'heure du conte des tout-petits","Enroulez le fil, déroulez le fil des histoires et des chansons !","Médiathèque Jean-Pierre Melville","79 rue Nationale","75013","Paris","48.826787000907, 2.36644000856506","gratuit","non","Public tout-petits. Jusqu'à 3 ans.","fr","September","2024","December","2024","Event","Ev-75013","kfevkg75","kfevkg75_2162"
"64249","https://www.paris.fr/evenements/l-heure-du-conte-des-grands-64249","L'heure du conte des grands","Enroulez le fil, déroulez le fil des histoires et des chansons !","Médiathèque Jean-Pierre Melville","79 rue Nationale","75013","Paris","48.826787000907, 2.36644000856506","gratuit","non","Public tout-petits et enfants. Jusqu'à 3 ans.","fr","September","2024","December","2024","Event","Ev-75013","kfevkg75","kfevkg75_1476"
"64252","https://www.paris.fr/evenements/atelier-creatif-du-mercredi-64252","Atelier créatif du mercredi","l'atelier créatif du mois pour les enfants du quartier","Médiathèque Jean-Pierre Melville","79 rue Nationale","75013","Paris","48.826787000907, 2.36644000856506","gratuit","obligatoire","Public enfants. A partir de 8 ans.","fr","September","2024","December","2024","Event","Ev-75013","kfevkg75","kfevkg75_2466"
"64253","https://www.paris.fr/evenements/atelier-jeu-du-mercredi-64253","Atelier jeu du mercredi","l'atelier jeu du mois pour les enfants du quartier #Paris13","Médiathèque Jean-Pierre Melville","79 rue Nationale","75013","Paris","48.826787000907, 2.36644000856506","gratuit","obligatoire","Public enfants. A partir de 7 ans.","fr","September","2024","December","2024","Event","Ev-75013","kfevkg75","kfevkg75_640"
"64254","https://www.paris.fr/evenements/atelier-escape-game-64254","Atelier Escape game","l'après-midi Escape Game du mois pour les enfants du quartier #Paris13","Médiathèque Jean-Pierre Melville","79 rue Nationale","75013","Paris","48.826787000907, 2.36644000856506","gratuit","obligatoire","Public enfants. A partir de 7 ans.","fr","October","2024","December","2024","Event","Ev-75013","kfevkg75","kfevkg75_2703"
"64255","https://www.paris.fr/evenements/tournoi-de-jeu-video-pour-les-enfants-64255","Tournoi de jeu vidéo pour les enfants","On se retrouve tou·te·s à la salle de jeu vidéo pour les enfants de la médiathèque #Paris13","Médiathèque Jean-Pierre Melville","79 rue Nationale","75013","Paris","48.826787000907, 2.36644000856506","gratuit","obligatoire","Public enfants. A partir de 7 ans.","fr","October","2024","November","2024","Event","Ev-75013","kfevkg75","kfevkg75_465"
"64280","https://www.paris.fr/evenements/doible-plateau-kito-et-myra-64280","Doible plateau : Kito et Myra","Double plateau mixte ouvert à deux artistes émergents, bien dans notre époque qui métissent les genres musicaux, les émotions au quotidien et les images postées sur Instagram.","Salle des fêtes","4 Rue des Anciennes Mairies","92000","Nanterre","48.8908207, 2.19769559999997","payant","obligatoire","Tout public.","fr","November","2024","November","2024","Event","Ev-92000","kfevkg75","kfevkg75_418"
"64281","https://www.paris.fr/evenements/dakchi-a-la-maison-de-la-musique-de-nanterre-64281","Dakchi à la Maison de la musique de Nanterre","Oum, autrice, compositrice et chanteuse marocaine, est une perle du Sahara : voix nacrée, atmosphère aux couleurs changeantes sur un territoire musical tissé d’influences.","Maison de la musique de Nanterre","8 Rue des Anciennes Mairies","92000","Nanterre","48.8913440000691, 2.1981280400409","payant","obligatoire","Tout public.","fr","December","2024","December","2024","Event","Ev-92000","kfevkg75","kfevkg75_619"
"64282","https://www.paris.fr/evenements/waly-dia-a-la-maison-de-la-musique-a-la-maison-de-la-musique-de-nanterre-64282","Waly dia à la Maison de la musique à la Maison de la musique de Nanterre","Nouveau spectacle, nouvelle tournée du stand-uppeur, chroniqueur et comédien Waly Dia, armé de sa sulfateuse chargée à vannes réelles. « Accordez-moi une heure, je me charge du reste… ».","Maison de la musique de Nanterre","8 Rue des Anciennes Mairies","92000","Nanterre","48.8913440000691, 2.1981280400409","payant","obligatoire","Tout public.","fr","January","2025","January","2025","Event","Ev-92000","kfevkg75","kfevkg75_1475"
"64283","https://www.paris.fr/evenements/va-aimer-a-la-maison-de-la-musique-de-nanterre-64283","VA AIMER ! à la Maison de la musique de Nanterre","Drôle d’oiseau en cage que la comédienne Eva Rami qui réussit à nous faire rire avec ses histoires d’amour et d’emprise. Rire aux éclats et aux larmes. Molière 2024 du meilleur « Seul en scène ».","Maison de la musique de Nanterre","8 Rue des Anciennes Mairies","92000","Nanterre","48.8913440000691, 2.1981280400409","payant","obligatoire","Tout public.","fr","January","2025","January","2025","Event","Ev-92000","kfevkg75","kfevkg75_353"
"64284","https://www.paris.fr/evenements/mouh-milano-en-concert-a-la-maison-de-la-musique-de-nanterre-64284","Mouh Milano en concert à la Maison de la musique de Nanterre","Mouh Milano aborde les questions sociales profondes et ses clips font partie des vidéos les plus populaires sur YouTube au Maghreb.","Maison de la musique de Nanterre","8 Rue des Anciennes Mairies","92000","Nanterre","48.8913440000691, 2.1981280400409","payant","obligatoire","Tout public.","fr","February","2025","February","2025","Event","Ev-92000","kfevkg75","kfevkg75_523"
"64285","https://www.paris.fr/evenements/soiree-decouverte-rap-64285","Soirée découverte rap","Après le concert de Ledos en février 2024, nouvelle collaboration avec le label Grandstanding, toujours pour une soirée toujours placée sous le signe du rap hexagonal.","Salle des fêtes","4 Rue des Anciennes Mairies","92000","Nanterre","48.8908207, 2.19769559999997","payant","obligatoire","Tout public.","fr","February","2025","February","2025","Event","Ev-92000","kfevkg75","kfevkg75_2412"
"64286","https://www.paris.fr/evenements/faada-freddy-en-concert-64286","Faada Freddy en concert","La musique de Faada Freddy est « 100 % organique, bio, sans technologie ni pesticides ! » et il a la classe indispensable pour fédérer très largement autour de la soul, du blues et des racines sénégalaises.","Maison de la musique de Nanterre","8 Rue des Anciennes Mairies","92000","Nanterre","48.8913440000691, 2.1981280400409","payant","obligatoire","Tout public.","fr","February","2025","February","2025","Event","Ev-92000","kfevkg75","kfevkg75_2160"
"64287","https://www.paris.fr/evenements/decouverte-de-jeunes-rappeuses-64287","Découverte de jeunes rappeuses","Les femmes qui rappent sont à l'honneur !","Salle des fêtes","4 Rue des Anciennes Mairies","92000","Nanterre","48.8908207, 2.19769559999997","payant","obligatoire","Tout public.","fr","March","2025","March","2025","Event","Ev-92000","kfevkg75","kfevkg75_2320"
"64289","https://www.paris.fr/evenements/nacken-8-ans-64289","Näcken - 8 ans","Trois bidouilleurs d'instruments et deux chanteuses polyglottes nous embarquent dans une aventure musicale inspirées par des légendes célèbres.","Salle des fêtes","4 Rue des Anciennes Mairies","92000","Nanterre","48.8908207, 2.19769559999997","payant","obligatoire","Public enfants, jeunes et adultes. A partir de 8 ans.","fr","March","2025","March","2025","Event","Ev-92000","kfevkg75","kfevkg75_724"
"64290","https://www.paris.fr/evenements/les-filles-ne-sont-pas-des-poupees-de-chiffon-64290","Les filles ne sont pas des poupées de chiffon","Nathalie Bensard met en lumière le fossé qui existe encore entre le sort des filles et celui des garçons au XXIè siècle.","Maison de la musique de Nanterre","8 Rue des Anciennes Mairies","92000","Nanterre","48.8913440000691, 2.1981280400409","payant","obligatoire","Public enfants, jeunes et adultes.","fr","March","2025","March","2025","Event","Ev-92000","kfevkg75","kfevkg75_725"
"64291","https://www.paris.fr/evenements/oiseau-64291","Oiseau","Anna Nozière fait preuve d'un talent rare, celui d'écrire à la hauteur d'enfance. Dans cette pièce, elle aborde la question du deuil avec justesse et éclat.","Maison de la musique de Nanterre","8 Rue des Anciennes Mairies","92000","Nanterre","48.8913440000691, 2.1981280400409","payant","obligatoire","Public enfants, jeunes et adultes.","fr","February","2025","February","2025","Event","Ev-92000","kfevkg75","kfevkg75_1206"
"64292","https://www.paris.fr/evenements/premieres-neiges-des-3-ans-64292","Premières Neiges - dès 3 ans","Un duo de musiciennes nous emmène dans une balade musicale électro et poétique. Les tout-petits effectuent à leurs côtés leurs premiers pas dans la neige.","Salle des fêtes","4 Rue des Anciennes Mairies","92000","Nanterre","48.8908207, 2.19769559999997","payant","obligatoire","Tout public. A partir de 3 ans.","fr","January","2025","January","2025","Event","Ev-92000","kfevkg75","kfevkg75_1821"
"64293","https://www.paris.fr/evenements/icare-des-5-ans-64293","Icare - dès 5 ans","Grâce à une lecture inédite du mythe d'Icare, l'auteur et metteur en scène Guillaume Barbot tente de répondre à cette question : comment accompagner son enfant vers l'indépendance ?","Maison de la musique de Nanterre","8 Rue des Anciennes Mairies","92000","Nanterre","48.8913440000691, 2.1981280400409","payant","obligatoire","Public enfants, jeunes et adultes. A partir de 5 ans.","fr","January","2025","January","2025","Event","Ev-92000","kfevkg75","kfevkg75_157"
"64294","https://www.paris.fr/evenements/on-va-au-parc-des-5-ans-64294","On va au parc - dès 5 ans","Empreint d’émerveillement, ce concert-spectacle Sara Stridsberg autant que des images de l’illustratrice Beatrice Alemagna.","Nanterre-Amandiers","7 Avenue Pablo Picasso","92000","Nanterre","48.8931821, 2.2141363","payant","obligatoire","Public enfants, jeunes et adultes. A partir de 5 ans.","fr","December","2024","December","2024","Event","Ev-92000","kfevkg75","kfevkg75_419"
"64295","https://www.paris.fr/evenements/geologie-d-une-fable-des-6-ans-64295","Géologie d'une fable - dès 6 ans","Cette création se vit comme une expérience esthétique pour les spectateurs qui découvrent deux artistes dessinant et modelant de l’argile en direct.","Maison de la musique de Nanterre","8 Rue des Anciennes Mairies","92000","Nanterre","48.8913440000691, 2.1981280400409","payant","obligatoire","Public enfants, jeunes et adultes. A partir de 6 ans.","fr","December","2024","December","2024","Event","Ev-92000","kfevkg75","kfevkg75_2187"
"64296","https://www.paris.fr/evenements/horace-le-coucou-qui-fait-hi-han-des-6-ans-64296","Horace, le coucou qui fait hi han - dès 6 ans","C'est le cabaret des animaux aux cris qui clochent?! Horace, l'oiseau qui devrait faire coucou, fait l'âne sans le vouloir… Un conte musical pour enfants, rigolo mais pas que, avec une voix qui chante","Maison de la musique de Nanterre","8 Rue des Anciennes Mairies","92000","Nanterre","48.8913440000691, 2.1981280400409","payant","obligatoire","Public enfants, jeunes et adultes. A partir de 6 ans.","fr","November","2024","November","2024","Event","Ev-92000","kfevkg75","kfevkg75_726"
"64297","https://www.paris.fr/evenements/valse-avec-w-des-6-ans-64297","Valse avec W… - dès 6 ans","Le chorégraphe Marc Lacourt relève le défi de continuer à danser dans un monde qui s’écroule. Il ne le fait pas seul, l’hurluberlu s’entoure cette fois de quatre danseurs.","Maison de la musique de Nanterre","8 Rue des Anciennes Mairies","92000","Nanterre","48.8913440000691, 2.1981280400409","payant","obligatoire","Public enfants, jeunes et adultes. A partir de 6 ans.","fr","November","2024","November","2024","Event","Ev-92000","kfevkg75","kfevkg75_727"
"64298","https://www.paris.fr/evenements/tabula-des-18-mois-64298","Tabula - dès 18 mois","Dans cette pièce pour tout-petits, un danseur et un musicien partent de l'espace restreint d'une table pour ouvrir les grands espaces fertiles de l'imaginaire de l'enfance.","Salle des fêtes","4 Rue des Anciennes Mairies","92000","Nanterre","48.8908207, 2.19769559999997","payant","obligatoire","Tout public.","fr","November","2024","November","2024","Event","Ev-92000","kfevkg75","kfevkg75_1057"
"64510","https://www.paris.fr/evenements/la-bibliotheque-andree-chedid-fete-ses-50-ans-avec-l-art-contemporain-64510","La bibliothèque Andrée Chedid fête ses 50 ans avec l'art contemporain","La bibliothèque Andrée Chedid a ouvert en mai 1974 dans le quartier de Beaugrenelle. Pour fêter ses 50 ans, elle s'associe au Fonds d'art contemporain - Paris Collections pour proposer 7 œuvres à son public du 17 septembre au 12 décembre 2024","Bibliothèque Andrée Chedid","36, rue Emeriau","75015","Paris","48.8500160206342, 2.28643097089903","gratuit","non","Tout public.","fr","September","2024","December","2024","Event","Ev-75015","kfevkg75","kfevkg75_1610"
"64511","https://www.paris.fr/evenements/atelier-danse-parents-enfants-avec-l-association-peekaboo-64511","Atelier danse parents-enfants avec l'association Peekaboo","Les duos sont à l’honneur à l’occasion du festival Monte le son. _x000D_\
_x000D_\
Coline Irwin (association Peekaboo) s'associe à la bibliothèque des Batignolles pour proposer deux séances d'ateliers parents-enfants autour des livres et de la danse.","Bibliothèque des Batignolles","18, rue des Batignolles","75017","Paris","48.8843410037851, 2.3220940410728","gratuit","obligatoire","Public tout-petits.","fr","November","2024","November","2024","Event","Ev-75017","kfevkg75","kfevkg75_1687"
"64529","https://www.paris.fr/evenements/the-sounds-of-sunset-grandir-avec-les-musiques-de-los-angeles-1960-1990-exposition-a-la-mmp-64529","« Sounds of Sunset : Grandir avec les musiques de Los Angeles – 1960-1990 » | Exposition à la MMP","À l’occasion du passage de la flamme olympique de Paris à Los Angeles, la MMP et la LAPL proposent une exposition photos autour des musiques et de la jeunesse à Los Angeles entre 1960 et 1990. Vous pourrez vous immerger dans une sélection de photos et de divers types de documents musicaux racontant cette époque à travers des groupes et des musiciens, des lieux emblématiques…","Médiathèque musicale de Paris (MMP)","8 porte Saint Eustache","75001","Paris","48.862798, 2.345658","gratuit","non","Tout public.","fr","September","2024","April","2025","Event","Ev-75001","kfevkg75","kfevkg75_1098"
"64576","https://www.paris.fr/evenements/exposition-jacques-de-loustal-64576","Exposition Jacques de Loustal","Illustrations, Carnets et croquis de voyages seront exposés à la bibliothèque Marguerite Audoux du 1er octobre au 2 novembre et une rencontre-dédicace avec l'artiste aura lieu, sur réservation, le samedi 12 octobre à 18 heures.","Bibliothèque Marguerite Audoux","10 rue Portefoin","75003","Paris","48.8637019921391, 2.35997404081746","gratuit","non","Tout public.","fr","October","2024","November","2024","Event","Ev-75003","kfevkg75","kfevkg75_1439"
"64632","https://www.paris.fr/evenements/redecouvrez-le-conte-la-belle-et-la-bete-au-theatre-du-lucernaire-64632","Redécouvrez le conte La Belle et la Bête au théâtre du Lucernaire !","La beauté se trouve dans le regard de l’autre.","Le Lucernaire","53, rue Notre-Dame des Champs","75006","Paris","48.8442420209033, 2.33040302169061","payant","obligatoire","Public enfants, jeunes et adultes. A partir de 6 ans.","fr","September","2024","January","2025","Event","Ev-75006","kfevkg75","kfevkg75_939"
"64668","https://www.paris.fr/evenements/invitation-au-voyage-exposition-photographique-64668","\" Invitation au voyage\" Exposition photographique.","Les clichés de professionnels ou d'amateurs conservés à la Bibliothèque de l'Hôtel de Ville (BHdV) sont d'extraordinaires invitations au voyage à travers l'espace et… le temps. Il apparaît ainsi tout naturel qu'ils soient exposés à la Bibliothèque du tourisme et des voyages (BTV) ! C'est une sélection de 45 fac-similés qui sont à découvrir, sur support papier ou transparent, du 14 septembre au 16 novembre 2024.","Bibliothèque Germaine Tillion","6 rue du Commandant Schlœsing","75016","Paris","48.8618360128542, 2.28427103826974","gratuit","non","Tout public.","fr","September","2024","November","2024","Event","Ev-75016","kfevkg75","kfevkg75_82"
"64787","https://www.paris.fr/evenements/the-sounds-of-sunset-grandir-avec-les-musiques-de-los-angeles-1960-1990-exposition-dans-le-jardin-nelson-mandela-64787","« Sounds of Sunset : Grandir avec les musiques de Los Angeles – 1960-1990 » | Exposition devant l'église Saint Eustache","À l’occasion du passage de la flamme olympique de Paris à Los Angeles, la MMP et la LAPL proposent une exposition photos autour des musiques et de la jeunesse à Los Angeles entre 1960 et 1990. Dans le jardin Nelson Mandela 32 photos racontent cette époque à travers des groupes et des musiciens, des lieux emblématiques, l’évolution de la mode…","Médiathèque musicale de Paris (MMP)","8 porte Saint Eustache","75001","Paris","48.862798, 2.345658","gratuit","non","Tout public.","fr","September","2024","October","2024","Event","Ev-75001","kfevkg75","kfevkg75_743"
"64850","https://www.paris.fr/evenements/the-dire-straits-experience-world-tour-shiver-in-the-dark-64850","The Dire Straits Experience WORLD TOUR « SHIVER IN THE DARK »","The Dire Straits Experience revient à Paris le 6 novembre !","Zénith Paris La Villette","211 Avenue Jean Jaurès","75019","Paris","48.8890966, 2.3920745","payant","obligatoire","Tout public.","fr","November","2024","November","2024","Event","Ev-75019","kfevkg75","kfevkg75_2758"
"64878","https://www.paris.fr/evenements/le-p-tit-cine-de-margot-projection-jeunesse-64878","Le P’tit ciné de Margot – Projection jeunesse","Pendant les vacances scolaires, la médiathèque vous propose deux après-midis cinéma à destination des enfants !","Médiathèque Marguerite Yourcenar","41, rue d'Alleray","75015","Paris","48.83680697942, 2.30348101924335","gratuit","non","Public enfants et jeunes. A partir de 5 ans.","fr","October","2024","October","2024","Event","Ev-75015","kfevkg75","kfevkg75_357"
"64879","https://www.paris.fr/evenements/atelier-pop-up-avec-elena-selena-64879","Atelier pop-up avec Elena Selena","Dans le cadre de la saison culturelle consacrée à la Lituanie, la bibliothèque vous propose un atelier pop-up animé par Elena Selena, illustratrice et scénographe._x000D_\
_x000D_\
_x000D_\
sur inscription à partir du 22 octobre","Bibliothèque Colette Vivier","6 rue Fourneyron","75017","Paris","48.8897829963312, 2.31964300494624","gratuit","obligatoire","Public enfants et adultes. A partir de 5 ans. Jusqu'à 8 ans.","fr","November","2024","November","2024","Event","Ev-75017","kfevkg75","kfevkg75_621"
"64882","https://www.paris.fr/evenements/exposition-les-9-vies-extraordinaires-de-la-princesse-gaya-64882","Exposition : les 9 vies extraordinaires de la princesse Gaya","Une promenade visuelle dans ce conte grandiose qui suit la Princesse Gaya dans différentes époques et différents pays - un projet de Régis Lejonc avec les éditions Little Urban.","Bibliothèque André Malraux","112 rue de Rennes","75006","Paris","48.847914, 2.327471","gratuit","non","Public jeunes et adultes. A partir de 9 ans.","fr","November","2024","January","2025","Event","Ev-75006","kfevkg75","kfevkg75_39"
"64906","https://www.paris.fr/evenements/tokyo-au-fil-des-jours-une-exposition-de-martine-amalvict-64906","Tokyo au fil des jours : une exposition de Martine Amalvict","Cette exposition est un carnet de voyage en photographie réalisés lors de ses séjours à Tokyo._x000D_\
En marge de cette exposition un cycle de rencontres ,conférences, projections et visites commentées sera déclinée autour du thème du Japon.","Bibliothèque Jacqueline Dreyfus-Weill","6 rue Fessart","75019","Paris","48.87626897957, 2.38818400650666","gratuit","non","Tout public.","fr","October","2024","January","2025","Event","Ev-75019","kfevkg75","kfevkg75_1724"
"64914","https://www.paris.fr/evenements/un-spectacle-d-impro-entre-amis-ou-en-famille-64914","Un spectacle d'impro entre amis ou en famille au Théâtre de Nesle","Condensé de talent, d’énergie et de créativité, Impro ! est le spectacle idéal pour bien commencer votre soirée !","Théâtre de Nesle","8, rue de Nesle","75006","Paris","48.8552369823936, 2.33910402391996","payant","conseillée","Public enfants, jeunes et adultes. A partir de 10 ans.","fr","October","2024","June","2025","Event","Ev-75006","kfevkg75","kfevkg75_2539"
"64964","https://www.paris.fr/evenements/festival-artistique-le-vivier-64964","Festival Artistique Le Vivier au Théâtre El Duende","Quand les frontières deviennent des ponts… Le Vivier est un festival pluridisciplinaire témoignant des sujets et enjeux sociétaux que traversent un monde en perte de repères.","Théâtre El Duende","23 rue Hoche","94200","Ivry-sur-Seine","48.8110280171088, 2.3782660357553","payant","conseillée","Tout public.","fr","November","2024","November","2024","Event","Ev-94200","kfevkg75","kfevkg75_1701"
"65013","https://www.paris.fr/evenements/mif-expo-le-salon-du-made-in-france-65013","MIF Expo, Le Salon du Made in France","Retrouvez plus de 1 000 exposants Made In France au Parc des Exposition à Porte de Versailles les 8, 9, 10 et 11 novembre 2024.","Parc des Expositions","1 Pl. de la Porte de Versailles","75015","Paris","48.8320329826474, 2.28870799871567","gratuit sous condition","obligatoire","Tout public.","fr","November","2024","November","2024","Event","Ev-75015","kfevkg75","kfevkg75_2421"
"65061","https://www.paris.fr/evenements/the-inspector-cluzo-1ere-partie-65061","The Inspector Cluzo et 1ère partie au EMB Sannois","The Inspector Cluzo ou l’incroyable aventure de ces deux rock-farmers gascons qui parcourent la planète depuis 17 ans.","EMB Sannois","2, rue du président Georges Pompidou","95110","Sannois","48.9730339865075, 2.26462603652135","payant","obligatoire","Tout public.","fr","November","2024","November","2024","Event","Ev-95110","kfevkg75","kfevkg75_1478"
"65062","https://www.paris.fr/evenements/claude-1ere-partie-65062","Claude et 1ère partie au EMB Sannois","Claude revient sur scène : Flanqué de ses textes ultra-lucides portés par des mélodies inoubliables et des machines spécialement paramétrées pour vous faire chanter et danser jusqu'à épuisement.","EMB Sannois","2, rue du Président Georges Pompidou","95110","Sannois","48.9730339865075, 2.26462603652135","payant","obligatoire","Tout public.","fr","November","2024","November","2024","Event","Ev-95110","kfevkg75","kfevkg75_2165"
"65063","https://www.paris.fr/evenements/nikola-asfar-shamsi-65063","Nikola et Asfar Shamsi au EMB Sannois","Nikola, chansonnier entre la France et le Monténégro. Asfar Shamsi avec des textes bruts et sincères, elle esquisse une mélancolie qu'elle côtoie trop souvent contre son grès.","EMB Sannois","2, rue du Président Georges Pompidou","95110","Sannois","48.9730339865075, 2.26462603652135","payant","obligatoire","Tout public.","fr","November","2024","November","2024","Event","Ev-95110","kfevkg75","kfevkg75_360"
